<?xml version="1.0" ?>
<xsd:schema xmlns:xsd="http://www.w3.org/2001/XMLSchema">
  <xsd:element name="timetable">
    <xsd:complexType>
      <xsd:sequence>
        <xsd:element name="dayOfWeek" maxOccurs="unbounded" minOccurs="0">
          <xsd:complexType>
            <xsd:sequence>
              <xsd:element name="subject" maxOccurs="unbounded" minOccurs="0">
                <xsd:complexType>
                  <xsd:sequence>
                    <xsd:element name="lecturer" type="xsd:string"/>
                    <xsd:element name="kind" type="xsd:string"/>
                    <xsd:element name="auditory" type="xsd:string"/>
                  </xsd:sequence>
                  <xsd:attribute name="start" type="xsd:string"/>
                  <xsd:attribute name="end" type="xsd:string"/>
                  <xsd:attribute name="name" type="xsd:string"/>
                </xsd:complexType>
              </xsd:element>
            </xsd:sequence>
            <xsd:attribute name="name" type="xsd:string"/>
          </xsd:complexType>
        </xsd:element>
      </xsd:sequence>
    </xsd:complexType>
  </xsd:element>
</xsd:schema>